{
  "artifact_sha256": "3333333333333333333333333333333333333333333333333333333333333333",
  "build_commit": "0000000000000000000000000000000000000000",
  "config_bundle_sha256": "2222222222222222222222222222222222222222222222222222222222222222",
  "contract_manifest_sha256": "1111111111111111111111111111111111111111111111111111111111111111",
  "emitted_at_us": 1786156800123456,
  "event_id": "evt_triad_structure_atom_v2",
  "event_kind": "STRUCTURE_CONFIRMED",
  "payload": {
    "availability_time_us": 1786156800123456,
    "build_commit": "x",
    "canonical_instrument_id": "x",
    "config_bundle_sha256": "0000000000000000000000000000000000000000000000000000000000000000",
    "confirmation_source_ids": [],
    "confirmation_time_us": 1786156800123456,
    "dependency_quality": {},
    "direction": "LONG",
    "formula_version": "x",
    "instrument_digest": "0000000000000000000000000000000000000000000000000000000000000000",
    "knowledge_time_us": 1786156800123456,
    "origin_source_ids": [],
    "origin_time_us": 1786156800123456,
    "original_geometry": {},
    "original_geometry_digest": "0000000000000000000000000000000000000000000000000000000000000000",
    "parameter_digest": "0000000000000000000000000000000000000000000000000000000000000000",
    "parameter_set_id": "x",
    "predecessor_structure_ids": [],
    "reference_level_ids": [],
    "semantic_instance_id": "x",
    "source_offset_range": [],
    "state": "CONFIRMED",
    "structure_id": "x",
    "structure_kind": "x",
    "structure_subtype": "x",
    "timeframe": "x",
    "venue_model": "x"
  },
  "producer_epoch": "42",
  "producer_instance_id": "inst_golden_01",
  "producer_service": "origin",
  "schema": "triad.structure_atom.v2",
  "schema_version": "2.0.0"
}
